{
  "schemaVersion": 1,
  "id": "org.dcam.stock.rotate",
  "parameters": { "type": "object", "additionalProperties": false },
  "inputs": [
    { "id": "in", "type": "frame", "formats": ["YUV_420_888", "RAW_SENSOR"] }
  ],
  "outputs": [
    { "id": "out", "type": "frame", "formats": ["YUV_420_888", "RAW_SENSOR"] }
  ]
}
