{
  "schemaVersion": 1,
  "id": "org.dcam.stock.init",
  "parameters": {
    "type": "object",
    "properties": {
      "zslDepth": {
        "type": "integer",
        "default": 0
      },
      "disablePreviewStream": {
        "type": "boolean",
        "default": false
      },
      "customWidth": {
        "type": "integer",
        "default": 0
      },
      "customHeight": {
        "type": "integer",
        "default": 0
      }
    },
    "additionalProperties": false
  },
  "inputs": [
    {
      "id": "frame",
      "type": "frame",
      "formats": [
        "YUV_420_888",
        "RAW_SENSOR"
      ]
    },
    {
      "id": "metadata",
      "type": "metadata"
    },
    {
      "id": "request",
      "type": "requestState"
    },
    {
      "id": "output",
      "type": "outputFd"
    },
    {
      "id": "parameters",
      "type": "parameters"
    }
  ],
  "outputs": [
    {
      "id": "out",
      "type": "frame",
      "formats": [
        "YUV_420_888",
        "RAW_SENSOR"
      ]
    }
  ]
}
