{
  "schemaVersion": 1,
  "id": "org.dcam.stock.buffersaver",
  "parameters": {
    "type": "object",
    "properties": {
      "tag": {
        "type": "string"
      }
    },
    "additionalProperties": false
  },
  "inputs": [
    {
      "id": "in",
      "type": "frame",
      "formats": [
        "YUV_420_888",
        "RAW_SENSOR"
      ]
    }
  ],
  "outputs": [
    {
      "id": "out",
      "type": "frame",
      "formats": [
        "YUV_420_888",
        "RAW_SENSOR"
      ]
    }
  ]
}
